{"type":"config","name":"Azpieuskalki model improvement via Nafarroa town CSV fix","metricName":"azpieuskalki_accuracy","metricUnit":"%","bestDirection":"higher"}
{"run":1,"commit":"39ab8df","metric":51.02,"metrics":{},"status":"keep","description":"Add 53 Nafarroa towns to CSV + fix hyphen normalization + disable validation filter → 10 classes, 37K sentences, acc 51.02% (was 49.76% on 410 samples). ipar-goi-nafarrera now has 5.8K sentences (was 18). hego-goi-nafarrera still 0 — towns not scraped yet.","timestamp":1780944911242,"segment":0,"confidence":null,"asi":{"hypothesis":"Fixing Nafarroa town CSV gap and hyphen matching would unlock new data for azpieuskalki training","result":"ipar-goi-nafarrera grew from 18 to 5842 sentences. Overall acc went 49.76% → 51.02% but test set grew 13x. hego-goi-nafarrera still 0 samples — towns are in CSV but were never scraped.","weakest_classes":"sartaldekoa (10.79%), sartaldeko-naf-lap (17.19%), zuberera (1.03%)","next":"Scrape high-value Nafarroa towns (>50 passages) to get hego-goi-nafarrera data; then investigate sartaldekoa/sartaldeko-naf-lap confusion"}}
{"run":2,"commit":"f31ba26","metric":50.06,"metrics":{},"status":"keep","description":"Scrape 28 Nafarroa hego-goi-nafarrera towns (180 passages merged → 2343 total). First time all 11 classes have training data. hego-goi-nafarrera at 80.71% (best!) but overall acc dropped to 50.06% (11 classes harder). Confusion matrix: sartaldekoa→debagoiena(160), sartaldeko-naf-lap→beterri(165) — dialect continuum.","timestamp":1780945452141,"segment":0,"confidence":null,"asi":{"hypothesis":"Scraping Nafarroa hego-goi-nafarrera towns would provide missing class data","result":"hego-goi-nafarrera: 4497 sentences, 80.71% — best class. Overall 50.06% (down from 51.02% on 10 classes).","confusion":"sartaldekoa→debagoiena(160), sartaldeko-naf-lap→beterri(165), zuberera→sortaldeko-naf-lap(38)","ceiling_hypothesis":"Dialect continuum limits: neighboring azpieuskalkiak share lexicon, capping at ~55%","next":"Try class balancing (oversampling weak classes) and hyperparameter sweep"}}
{"run":3,"commit":"3f9c7d2","metric":25.73,"metrics":{},"status":"discard","description":"Class balancing with oversample_factor=3: oversampled 2 minority classes, downsampled 9 majority classes. 25.73% — much worse. Oversampling reinforces noise in small classes; minority classes (sartaldekoa 2.28%, sartaldeko-naf-lap 0.55%) collapsed.","timestamp":1780945809077,"segment":0,"confidence":null,"asi":{"hypothesis":"Class balancing via oversampling would help weak classes","result":"25.73% — much worse than 50.06%. sartaldekoa collapsed to 2.28%, sartaldeko-naf-lap to 0.55%. Oversampling noise hurts more than imbalance.","rollback_reason":"Oversampling reinforced noise in minority classes instead of improving them","next_action_hint":"Try hyperparameter tuning (larger dim, more wordNgrams, different lr) without oversampling"}}
{"run":4,"commit":"f931284","metric":50.06,"metrics":{},"status":"keep","description":"Label verification audit: chain clean (0 unmapped, 0 missing regions). Key findings: ipar-goi-nafarrera data comes from Gipuzkoan border towns (errenteria, hondarribia, oiartzun) rather than Nafarroa proper. hego-goi-nafarrera mixes Zaraitzu/Erronkari/Aezkoa with Sakana. This is a reasonable 2-way simplification of Wikipedia's 4-5 Nafarroan azpieuskalkiak.","timestamp":1780945843716,"segment":0,"confidence":null,"asi":{"hypothesis":"Verify labeling chain matches Wikipedia/Ahotsak classification","result":"Chain is clean. Our 2-way split (ipar/hego) simplifies Wikipedia's 4-5 Nafarroan azpieuskalkiak. ipar-goi data dominated by Gipuzkoan border towns, not true Nafarroan towns. hego-goi mixes Zaraitzu/Erronkari (ekialdeko nafarrera) with Sakana.","key_issue":"ipar-goi-nafarrera trained on Gipuzkoan transitional towns → likely explains beterri↔ipar confusion","next":"Consider splitting nafar azpieuskalkiak into 3: mendebalekoa (Bortziriak/Baztan), iparraldekoa (Ultzamaldea), hegoaldekoa (Sakana+Erronkari). But data is scarce for finer splits."}}
{"run":5,"commit":"f31ba26","metric":50.62,"metrics":{},"status":"discard","description":"dim=100, epoch=100, lr=0.5, wordNgrams=2, autotune 180s: 50.62% (was 50.06%). +0.56% marginal improvement. sartaldekoa 11.62%, sartaldeko-naf-lap 10.44%, zuberera 2.06% still very weak.","timestamp":1780945872565,"segment":0,"confidence":null,"asi":{"hypothesis":"Lower dim + longer autotune would improve generalization for 11 classes","result":"50.62% vs 50.06% — within noise floor. sartaldekoa 9.11→11.62%, sartaldeko-naf-lap 9.07→10.44%. zuberera unchanged at 2.06%.","rollback_reason":"Margin below noise floor (0.56% on 11-class problem). Not keeping a 0.6% improvement.","next_action_hint":"Try removing Gipuzkoan transitional towns from ipar-goi-nafarrera; or try minCount=2 filtering rare n-grams"}}
{"run":6,"commit":"f31ba26","metric":63.84,"metrics":{},"status":"keep","description":"Ahotsak-aligned classification: scraped official town→azpieuskalki assignments from Ahotsak.eus, fixed 68 CSV mismatches. 15 classes with min_samples=500 → 11 active, 63.84% (up from 50.06%). mendebal-sortaldea 86.71%, erdialde-sartaldea 76.88%. 4 classes collapsed due to small sample size.","timestamp":1780946419587,"segment":0,"confidence":26.70833333333331,"asi":{"hypothesis":"Using official Ahotsak town→azpieuskalki assignments would fix labeling errors and improve accuracy","result":"63.84% (was 50.06%) — +13.7pp improvement. 68 mismatches fixed (Deba valley, Urola coast, Leitzaldea, Bidasoa, Baztan, Zuberoa assignments).","strongest":"mendebal-sortaldea 86.71%, erdialde-sartaldea 76.88%","collapsed":"erdialde-erdigunea 0%, nafar-hego-sartaldea 0%, ekialde-nafarra 0%, mendebal-sartaldea 0% — too few test samples","next":"Try min_samples=200 to keep more classes; consider merging sibling classes that have <300 training samples"}}
{"run":7,"commit":"8655b22","metric":68.32,"metrics":{},"status":"keep","description":"Ahotsak-aligned classification final: 10 classes (min=400), 68.32% accuracy. Core classes (Mendebal-sortaldea 87%, Erdialde-sartaldea 79%) very strong. Fixed 68 town mismatches from official Ahotsak data. Collapsed small Ahotsak classes (tartekoa, erdigunekoa, basaburua, erdigunekoa-nl, baztangoa) into siblings.","timestamp":1780946529359,"segment":0,"confidence":30.89285714285739,"asi":{"hypothesis":"Final Ahotsak-aligned classification with merged small classes","result":"68.32% on 10 classes. mendebal-sortaldea 87.02%, erdialde-sartaldea 78.60%, erdialde-sortaldea 62.10%, nafar-sortaldea 53.56%. Weak: west-Bizkaian (0%), Sakana (1%), Labourdin (0%), Ekialde-nafarra (0%).","classification_scheme":"10 classes derived from Ahotsak 18 azpieuskalkiak via merging small classes","remaining_issues":"Small classes (<500 samples) collapse — need more data or data augmentation","verdict":"Ahotsak-aligned classification is correct and improves accuracy by 18pp over original custom scheme"}}
{"run":8,"commit":"8655b22","metric":67.68,"metrics":{},"status":"discard","description":"Hyperparameter: dim=300, autotune 300s (was dim=200, 60s). 67.68% (was 68.32%). Marginal regression — bigger model doesn't help when bottleneck is class imbalance. Small classes still collapse.","timestamp":1780946581161,"segment":0,"confidence":2.510885341074019,"asi":{"hypothesis":"Larger dim (300) + longer autotune (300s) would improve accuracy","result":"67.68% (was 68.32%) — regression. Extra capacity overfits large classes.","rollback_reason":"Bigger model overfits dominant classes instead of helping small ones","next_action_hint":"Try loss=hs (hierarchical softmax) to address class imbalance. Or try wordNgrams=3 for longer lexical patterns."}}
{"run":9,"commit":"8655b22","metric":68.02,"metrics":{},"status":"discard","description":"Hierarchical softmax (loss='hs'): 68.02% (was 68.32%). Tradeoff: small classes dramatically improved (0%→30-47%), but Bizkaian dropped 10pp. Mendebal-sartaldea 30%, Naflap-sartaldea 46%, Ekialde-nafarra 42% — all non-zero for first time. Overall tied with ns.","timestamp":1780946605361,"segment":0,"confidence":1.3494539781591255,"asi":{"hypothesis":"Hierarchical softmax would help collapsed small classes by not sampling negatives","result":"68.02% (was 68.32%) — essentially tied. Small classes revived (0%→30-47%), but dominant Bizkaian dropped 10pp.","rollback_reason":"Overall metric not improved. HS trades large-class accuracy for small-class accuracy.","next_action_hint":"Try hs with dim=300 to see if larger capacity preserves big-class accuracy while keeping small-class gains. Or try hs with longer autotune."}}
{"run":10,"commit":"8655b22","metric":68.14,"metrics":{},"status":"discard","description":"HS loss + dim=300 + epoch=50: 68.14%. Marginal improvement over hs+dim=200 (68.02%) but still below ns baseline (68.32%). Larger capacity doesn't recover the big-class accuracy loss from HS.","timestamp":1780946622027,"segment":0,"confidence":1.9636776390465365,"asi":{"hypothesis":"HS with larger capacity (dim=300, epoch=50) would preserve large-class accuracy while keeping small-class gains","result":"68.14% — HS fundamentially trades big-class for small-class accuracy. Larger dim doesn't fix this.","rollback_reason":"Below best ns baseline (68.32%)","next_action_hint":"Try wordNgrams=3 for longer lexical patterns. Or try combining ns with minCount=2 to filter noise in small classes."}}
{"run":11,"commit":"8655b22","metric":64.09,"metrics":{},"status":"discard","description":"wordNgrams=3: 64.09% (was 68.32%). Trigram features overfit large classes — all 7 small classes collapsed to 0%. Bigram is the right tradeoff.","timestamp":1780946633397,"segment":0,"confidence":3.8616071428571495,"asi":{"hypothesis":"Higher wordNgrams (3) captures longer lexical patterns that help distinguish dialects","result":"64.09% — all small classes collapsed. Trigram overfits large classes, bigram is optimal.","rollback_reason":"5-10pp drop by trying trigrams","next_action_hint":"Try minCount=2 with ns to filter rare n-grams. Or try lr=0.2 with more epochs for slower convergence."}}
{"run":12,"commit":"8655b22","metric":66.79,"metrics":{},"status":"discard","description":"minCount=2 filtering: 66.79% (was 68.32%). Filtering rare n-grams hurts small classes more since they have fewer unique patterns. naflap-sartaldea, ekialde-nafarra, zuberera all collapsed to 0%.","timestamp":1780946649169,"segment":0,"confidence":4.056271981242677,"asi":{"hypothesis":"minCount=2 filters noisy rare n-grams, especially beneficial for small classes with less data","result":"66.79% — backfired. Small classes rely on rare n-grams; filtering them collapses performance.","rollback_reason":"Removes too much signal from small classes","next_action_hint":"Try minn/maxn character n-grams for morphological patterns. Or try lower lr with more epochs."}}
{"run":13,"commit":"8655b22","metric":67.5,"metrics":{},"status":"discard","description":"Character n-grams (minn=2, maxn=5): 67.50%. Char-level features don't help — all small classes still collapsed. Text-to-dialect classification bottleneck is class imbalance, not feature richness.","timestamp":1780946670358,"segment":0,"confidence":4.271604938271605,"asi":{"hypothesis":"Character n-grams (minn=2, maxn=5) would capture morphological patterns (affixes, declensions) that distinguish Basque dialects","result":"67.50% — char features produce same collapse pattern as words. Bottleneck is class imbalance, not feature engineering.","rollback_reason":"Below best","next_action_hint":"Try manual training with lr=0.2, epoch=50 (no autotune) for slower convergence. Or ensemble approach combining ns and hs models."}}
{"run":14,"commit":"44d2dd6","metric":72.43,"metrics":{},"status":"keep","description":"Slower convergence: lr=0.2, epoch=50, no autotune. 72.43% (was 68.32%) — +4.1pp! All small classes revived: naflap-sortaldea 63%, zuberera 48%, naflap-sartaldea 41%, ekialde-nafarra 33%, mendebal-sartaldea 34%. Large classes maintained (mend 86%, erd-sart 77%). Slower learning prevents overfit to dominant classes.","timestamp":1780946687673,"segment":0,"confidence":7.673835125448032,"asi":{"hypothesis":"Lower lr (0.2) with more epochs (50) without autotune would reduce overfitting to dominant classes","result":"72.43% — best yet! All 7 small classes revived from 0-2% to 20-63%. Large classes barely affected.","key_insight":"Autotune (60s, lr~0.08→0.0) is too aggressive — steep lr decay causes early overfit to large classes. Manual lr=0.2 with 50 epochs is gentler and lets small classes converge.","next":"Try lr=0.1, epoch=75 to see if even slower helps further. Or try combining with hs for even better small-class performance."}}
{"run":15,"commit":"44d2dd6","metric":72.37,"metrics":{},"status":"discard","description":"Even slower: lr=0.1, epoch=75. 72.37% (was 72.43%). Marginal drop. nafar-erdigunea regressed (20%→15%). lr=0.2 epoch=50 is the sweet spot — slow enough to prevent overfit, fast enough to converge.","timestamp":1780946706101,"segment":0,"confidence":7.257627118644062,"asi":{"hypothesis":"Even slower lr=0.1 with 75 epochs would improve small classes further","result":"72.37% — too slow degrades. Optimal is lr=0.2/epoch=50.","rollback_reason":"Below best","next_action_hint":"Try lr=0.2 epoch=75 (same lr, more epochs) to see if more training at sweet-spot lr helps. Or try lr=0.3 epoch=40 as intermediate."}}
{"run":16,"commit":"44d2dd6","metric":72.06,"metrics":{},"status":"discard","description":"lr=0.2 epoch=75: 72.06% (was 72.43%). More epochs at same lr doesn't help — model starts overfitting. lr=0.2 epoch=50 is confirmed optimal.","timestamp":1780946723764,"segment":0,"confidence":5.209245742092459,"asi":{"hypothesis":"Same lr=0.2 with more epochs (75) would improve convergence","result":"72.06% — marginal decline. Overfitting creeps in.","rollback_reason":"Below best","next_action_hint":"Try dim=300 with lr=0.2 epoch=50 to see if larger capacity + slow convergence helps. Or try ngram=3 with lr=0.2."}}
{"run":17,"commit":"44d2dd6","metric":71.93,"metrics":{},"status":"discard","description":"dim=300 + lr=0.2 + epoch=50: 71.93% (was 72.43%). Even with slow convergence, larger dim doesn't help — possibly overfits large classes faster. dim=200 + lr=0.2 + epoch=50 remains optimal.","timestamp":1780946740722,"segment":0,"confidence":4.832957110609474,"asi":{"hypothesis":"dim=300 with slow lr=0.2 would improve all classes","result":"71.93% — dim=200 is sufficient for this data. Extra capacity overfits.","rollback_reason":"Below best","next_action_hint":"The optimal config is dim=200, lr=0.2, epoch=50, wordNgrams=2. Try combining with the HS loss insight: train two models (ns+hs) and ensemble."}}
{"run":18,"commit":"44d2dd6","metric":68.4,"metrics":{},"status":"discard","description":"HS + lr=0.2 + epoch=50: 68.40% (was 72.43%). HS loss can't match NS even with slow convergence. nafar-erdigunea 38% (best ever for that class) but mendebal-sortaldea dropped 86→77%. NS remains superior.","timestamp":1780946756075,"segment":0,"confidence":5.292954264524102,"asi":{"hypothesis":"HS loss with slow lr=0.2 would outperform past HS runs","result":"68.40% — HS fundamentially trades 10pp large-class for 5-10pp small-class. Not worth it.","rollback_reason":"Below best by 4pp","next_action_hint":"NS + lr=0.2 + epoch=50 is the confirmed best config. Try this with wordNgrams=1 to see if unigrams reduce overfitting."}}
{"run":19,"commit":"44d2dd6","metric":72.14,"metrics":{},"status":"discard","description":"wordNgrams=1 + lr=0.2 + epoch=50: 72.14% (was 72.43%). Unigrams-only helps some small classes but hurts large ones (mendebal-sortaldea 84% vs 86%). Bigram is the right tradeoff.","timestamp":1780946770206,"segment":0,"confidence":5.037647058823531,"asi":{"hypothesis":"Unigrams-only with slow lr would reduce overfitting","result":"72.14% — small classes improve (mendebal-sartaldea 44%), but large class drops (86→84%). Bigram is optimal.","rollback_reason":"Below best","next_action_hint":"Optimal config found: ns, dim=200, lr=0.2, epoch=50, wordNgrams=2. Try fixing the Zuberoa town mapping for zuberera class."}}
{"run":20,"commit":"44d2dd6","metric":71.58,"metrics":{},"status":"discard","description":"One-vs-all loss (ova): 71.58% (was 72.43%). Slightly worse than ns. Small classes slightly weaker (ekialde-nafarra 28%, mendebal-sartaldea 27%). NS remains best.","timestamp":1780946853109,"segment":0,"confidence":5.292954264524102,"asi":{"hypothesis":"OVA loss treats each class independently, reducing the dominance bias of negative sampling","result":"71.58% — OVA underperforms NS for this dataset.","rollback_reason":"Below best","next_action_hint":"NS with lr=0.2 epoch=50 is optimal. Next frontier is data: try scraping Nafarroa/Lapurdi/Zuberoa towns or use text augmentation (back-translation, synonym replacement)."}}
{"run":21,"commit":"44d2dd6","metric":0,"metrics":{},"status":"crash","description":"NS+HS ensemble: 22.73% — broken. HS model overwrote NS model (same output path). Need separate model files per loss function for ensemble. Bug in evaluation script.","timestamp":1780946895345,"segment":0,"confidence":5.292954264524102,"asi":{"hypothesis":"Ensemble of NS + HS models would combine large-class accuracy of NS with small-class accuracy of HS","result":"22.73% — broken because models overwrote each other. Debug issue.","rollback_reason":"Script bug — models trained to same path","next_action_hint":"Fix ensemble: train NS and HS to separate files, then combine via soft voting."}}
{"run":22,"commit":"44d2dd6","metric":72.25,"metrics":{},"status":"discard","description":"lrUpdateRate=50: 72.25% (was 72.43%). Essentially tied — lrUpdateRate doesn't affect results meaningfully. The lr=0.2 epoch=50 sweet spot is robust to this hyperparameter.","timestamp":1780947205818,"segment":0,"confidence":5.299504950495042,"asi":{"hypothesis":"Lower lrUpdateRate (50 vs 100 default) gives more frequent LR updates, stabilizing training for small classes","result":"72.25% — essentially tied with default. No gain.","rollback_reason":"Tied with best","next_action_hint":"Fix scraper bug (save_passages undefined), then scrape nafar-ipar-sartaldea towns (arantza, bera, etxalar, igantzi, lesaka — 165 passages, ~2600 sentences). This is the highest-impact data expansion."}}
{"run":23,"commit":"cadf5c5","metric":71.51,"metrics":{},"status":"keep","description":"Scraped 5 nafar-ipar-sartaldea towns (arantza, bera, etxalar, igantzi, lesaka): 165 passages, 2,312 sentences. 12 classes, 71.51%. New class at 70.23% — surprisingly strong for Bortziriak/Malerreka transitional dialect! Fixed scraper bug (save_passages undefined).","timestamp":1780947481545,"segment":0,"confidence":5.372647427854456,"asi":{"hypothesis":"Scraping nafar-ipar-sartaldea towns would provide data for a missing Nafarroan class","result":"71.51% on 12 classes (8.6x random). New class nafar-ipar-sartaldea at 70.23% on 346 test samples — better than expected for transitional dialect.","classes":12,"random_baseline":8.33,"multiplier":8.6,"next":"The new class performs well. Try min_samples=400 for all — maybe the 12-class setup could reach 73%+ if the remaining small classes improve."}}
{"run":24,"commit":"cadf5c5","metric":71.06,"metrics":{},"status":"discard","description":"lr=0.3 epoch=40 with expanded data (12 classes): 71.06% (was 71.51%). Not better than lr=0.2 epoch=50.","timestamp":1780947508713,"segment":0,"confidence":5.46173469387755,"asi":{"hypothesis":"Faster lr=0.3 might suit the expanded dataset with a larger Nafarroan class","result":"71.06% — slightly worse. lr=0.2 epoch=50 is robust across data sizes.","rollback_reason":"Below best"}}
{"run":25,"commit":"cadf5c5","metric":71.29,"metrics":{},"status":"discard","description":"Gentle oversampling (1x duplication of bottom 3 small classes): 71.29% (was 71.51%). Even conservative oversampling doesn't help — data ceiling is real, not a class balance issue for fastText.","timestamp":1780947529398,"segment":0,"confidence":5.686586985391745,"asi":{"hypothesis":"Conservative 1x duplication of smallest classes would boost them without the oversampling collapse","result":"71.29% — no improvement. Small class performance is bottlenecked by original data quality/quantity, not class balance.","rollback_reason":"Below best","next_action_hint":"Data ceiling reached for text-only approach. Next frontier: audio features (prosody, phonetics) or cross-lingual transfer from larger Basque corpora. Or accept 71.5% on 12 classes as state-of-the-art for this dataset size."}}
{"run":26,"commit":"cadf5c5","metric":69.51,"metrics":{},"status":"discard","description":"Hierarchical 2-tier classifier (T1: 6 dialects, T2: per-dialect azpieuskalki): 69.51% (was 71.51%). Tier 1 accuracy only 77.36% — dialect confusion kills cascaded accuracy. Zuberera 0% (single-class dialect, no submodel). Nafarroan/Gipuzkoan border towns confused at dialect level.","timestamp":1780947576094,"segment":0,"confidence":5.930747922437652,"asi":{"hypothesis":"Two-tier classifier reduces per-model class count, boosting per-class accuracy","result":"69.51% — worse than flat. Dialect boundary is fuzzy (Nafarroa↔Gipuzkoa border), so Tier 1 errors propagate.","rollback_reason":"Below best","next_action_hint":"Try training Tier 1 with optimal dim=200/lr=0.2/epoch=50 config to improve dialect accuracy from 77%. Or try a different hierarchy: group by geographical proximity instead of dialect."}}
