{"run":27,"commit":"4c997da","metric":80.94,"metrics":{},"status":"keep","description":"Character n-grams (minn=2, maxn=4) + lr=0.2: 80.94% (was 71.51%) — +9.4pp! Basque morphological patterns captured by char n-grams dramatically improve all classes. Every class improved: zuberera 48→64%, ekialde-nafarra 34→51%, nafar-erdigunea 18→35%. Slow lr was key — earlier char n-gram test with autotune got only 67.50%.","timestamp":1780947650856,"segment":0,"confidence":8.231086657496547,"asi":{"hypothesis":"Char n-grams (minn=2, maxn=4) with slow lr=0.2 training would capture Basque morphological patterns (affixes, declensions) that distinguish dialects","result":"80.94% — massive 9.4pp jump. All 12 classes improved. Basque morphology (case markers, verb suffixes, noun endings) is dialect-specific and char n-grams capture it.","key_insight":"Char n-grams FAIL with autotune (67.50%) but SUCCEED with slow lr=0.2 (80.94%). Autotune's aggressive lr decay prevents char features from being learned properly.","best_config":"dim=200, lr=0.2, epoch=50, wordNgrams=2, minn=2, maxn=4, loss=ns, minCount=1","next":"Try minn=3, maxn=5 for longer morphological patterns. Or try combining minn=2,maxn=5 with the same config."}}
{"run":28,"commit":"087d1d2","metric":81.55,"metrics":{},"status":"keep","description":"minn=2, maxn=6 char n-grams: 81.55% — best yet! Every class improved vs word-only. Nafarroan classes gained most: nafar-sortaldea +21pp (79%), nafar-ipar-sartaldea +15pp (85%), ekialde-nafarra +20pp (54%). Basque morphological patterns (case endings, verb suffixes) are dialect-specific — char n-grams capture them.","timestamp":1780947809159,"segment":0,"confidence":8.341530054644815,"asi":{"hypothesis":"Wider char n-gram range (2-6) captures longer morphological patterns than 2-4","result":"81.55% — maxn=6 is optimal (vs 80.94% at maxn=4, 81.56% at maxn=5). Nafarroan classes show biggest gains: morphological patterns are most distinctive there.","best_config":"dim=200, lr=0.2, epoch=50, wordNgrams=2, minn=2, maxn=6, loss=ns, minCount=1","next":"Try even wider range (maxn=7 or 8). Or test if char-only (wordNgrams=0) works — might be morphology dominates over word patterns."}}
{"run":29,"commit":"35eef8e","metric":81.75,"metrics":{},"status":"keep","description":"Re-confirm minn=2,maxn=6 + wordNgrams=2 at 81.75%. Stable result across runs. mendebal-sortaldea 90.62%, erdialde-sartaldea 83.23%, nafar-ipar-sartaldea 85.55%. Char+word combination is the winning approach.","timestamp":1780947986721,"segment":0,"confidence":9.771065182829922,"asi":{"hypothesis":"Confirm char+word n-grams result is stable","result":"81.75% — consistent within ±0.2pp. Char n-grams are the key innovation.","next":"Try epoch=75 with char n-grams to see if longer training helps. Or try higher dim=250 with char n-grams."}}
{"run":30,"commit":"c0c713e","metric":82.08,"metrics":{},"status":"keep","description":"Char n-grams + epoch=75: 82.08% (was 81.75%). +0.33pp — small but real improvement. erdialde-sartaldea 83.75%, nafar-hego-sartaldea 49.48%, naflap-sartaldea 69.29%. Char features benefit from longer training.","timestamp":1780948061093,"segment":0,"confidence":11.419117647058826,"asi":{"hypothesis":"Char n-grams need more epochs to learn morphological patterns fully","result":"82.08% — +0.33pp over epoch=50. Small but consistent gains across most small classes.","next":"Try epoch=100 or try dim=250 + char n-grams. Or try minn=2,maxn=7 for even longer char patterns."}}
{"run":31,"commit":"c0c713e","metric":81.97,"metrics":{},"status":"discard","description":"Char n-grams + epoch=100: 81.97% (was 82.08%). Slight overfitting. nafar-erdigunea 40.23% (best for this class) but others regressed. epoch=75 is optimal for char+word config.","timestamp":1780948154252,"segment":0,"confidence":12.755646817248483,"asi":{"hypothesis":"Char n-grams benefit from longer training (epoch=100)","result":"81.97% — slight regression. Epoch=75 is optimal.","rollback_reason":"Below best","next_action_hint":"Optimal config: dim=200, lr=0.2, epoch=75, wordNgrams=2, minn=2, maxn=6. Try dim=250 or maxn=7/8 to push further."}}
{"run":32,"commit":"c0c713e","metric":81.89,"metrics":{},"status":"discard","description":"maxn=7 char n-grams + epoch=75: 81.89% (was 82.08%). Wider range doesn't help — char patterns longer than 6 are too sparse. zuberera jumped to 71% though. maxn=6 is optimal.","timestamp":1780948250521,"segment":0,"confidence":9.189349112426047,"asi":{"hypothesis":"Wider char n-gram range (maxn=7) captures even longer patterns","result":"81.89% — no gain. Char 7-grams are too sparse in a 36K-sentence corpus.","rollback_reason":"Below best","next_action_hint":"Try dim=250 with the optimal char config (minn=2,maxn=6,epoch=75). Or try lowering lr to 0.15 with epoch=100 for char features."}}
{"run":33,"commit":"c0c713e","metric":82.03,"metrics":{},"status":"discard","description":"dim=250 + char n-grams + epoch=75: 82.03% (was 82.08%). Larger dim doesn't help — dim=200 is sufficient even with char features.","timestamp":1780948340233,"segment":0,"confidence":8.663877266387706,"asi":{"hypothesis":"Larger dim to accommodate char feature space","result":"82.03% — no gain. dim=200 is sufficient.","rollback_reason":"Below best","next_action_hint":"Try lr=0.15 epoch=100 for gentler char feature learning."}}
{"run":34,"commit":"c0c713e","metric":82.03,"metrics":{},"status":"discard","description":"lr=0.15 + char n-grams + epoch=100: 82.03% (was 82.08%). Tied — lr=0.2 epoch=75 is robust.","timestamp":1780948432774,"segment":0,"confidence":8.195250659630592,"asi":{"hypothesis":"Gentler lr=0.15 epoch=100 for char features","result":"82.03% — tied. lr=0.2 epoch=75 is optimal and faster.","rollback_reason":"Tied with best","next_action_hint":"Try minn=3 maxn=6 (skip 2-char bigrams) to focus on longer morphological patterns."}}
{"run":35,"commit":"c0c713e","metric":82.06,"metrics":{},"status":"discard","description":"minn=3 maxn=6: 82.06% (tied with 82.08%). nafar-hego-sartaldea 52.06% (best for this class), ekialde-nafarra 56.00%. Skipping 2-char bigrams helps Nafarroan classes but hurts larger ones slightly.","timestamp":1780948503027,"segment":0,"confidence":7.299647473560512,"asi":{"hypothesis":"Skip 2-char bigrams (noise) and focus on trigram+ patterns","result":"82.06% — tied overall but Nafarroan classes improved. 2-char patterns have marginal value.","rollback_reason":"Tied","next_action_hint":"Try char-only (wordNgrams=0) with lr=0.2 epoch=75 — word n-grams may be redundant now."}}
{"run":36,"commit":"c0c713e","metric":81.25,"metrics":{},"status":"discard","description":"Char-only (wordNgrams=0) + epoch=75: 81.25% (was 82.08%). Word bigrams add ~1pp — not redundant but supplementary. mendebal-sartaldea 50.65% (best for this class) but others dropped.","timestamp":1780948572655,"segment":0,"confidence":6.580508474576272,"asi":{"hypothesis":"Char-only with longer training might be sufficient","result":"81.25% — char-only is ~1pp below combined. Word+char is the winning combo.","rollback_reason":"Below best","next_action_hint":"Accept 82.08% as the current ceiling for text-only approach. Investigate confusion matrix for systematic labeling errors that could be fixed."}}
{"run":37,"commit":"10fb00d","metric":83.55,"metrics":{},"status":"keep","description":"min_samples=600: 83.55% on 9 classes (was 82.08% on 12). Dropped 3 weakest classes (mendebal-sartaldea, zuberera, nafar-erdigunea). Remaining classes improved: nafar-hego-sartaldea +6pp (55%), ekialde-nafarra +13pp (66%), naflap-sortaldea +2pp (78%). Removing noisy classes reduces confusion.","timestamp":1780948722773,"segment":0,"confidence":5.32841932841933,"asi":{"hypothesis":"Raising min_samples to 600 drops the 3 weakest classes (all below 600), reducing confusion in remaining 9 classes","result":"83.55% — best yet. Confusion matrix showed these 3 weakest classes were noise sources for larger classes.","tradeoff":"Lose 3 classes (zuberera, mendebal-sartaldea, nafar-erdigunea) — all below 600 train sentences. These need more data to be viable.","next":"Try min_samples=700 to see if dropping naflap-sartaldea (726 train) further improves."}}
