{"run":26,"commit":"e420784","metric":0.5902,"metrics":{"f1_central":0.4018,"f1_nav-lab":0.0178,"f1_navarrese":0.4334,"f1_souletin":0.0861,"f1_western":0.7622},"status":"discard","description":"Balanced class weights: within noise of baseline (59.02% vs 57.57-59.06%). Weights don't help because accuracy is dominated by majority class (western=58% of test).","timestamp":1781354795834,"segment":3,"confidence":null,"asi":{"hypothesis":"Balanced class weights should penalize the majority class (western) more, improving minority F1","verdict":"No real change. Accuracy dominated by majority class.","rollback_reason":"Within noise — no improvement","next_action_hint":"Try deeper MLP or more epochs"}}
{"run":27,"commit":"4b2c243","metric":0.5953,"metrics":{"f1_central":0.3768,"f1_nav-lab":0.0056,"f1_navarrese":0.422,"f1_souletin":0.0297,"f1_western":0.7779},"status":"discard","description":"3-layer MLP (512→256→128→5), dropout=0.4, epochs=100. 59.53% — within noise of baseline. Western improved (+2.9pp) but central/nav-lab degraded.","timestamp":1781354843762,"segment":3,"confidence":null,"asi":{"hypothesis":"3-layer MLP with more epochs should capture more complex patterns in 1280-dim embeddings","verdict":"No real improvement. More capacity just overfits to majority class (western +2.9pp, central -0.9pp, nav-lab -0.9pp).","rollback_reason":"Within noise — worse on minority classes","next_action_hint":"Try lower lr or different architecture approach (cosine similarity, attention pooling instead of mean)"}}
{"run":28,"commit":"7d178f5","metric":0.5847,"metrics":{"f1_central":0.3842,"f1_nav-lab":0.0092,"f1_navarrese":0.4481,"f1_souletin":0.075,"f1_western":0.7635},"status":"discard","description":"Lower lr=3e-4, dropout=0.5, weight_decay=1e-3, epochs=150. 58.47% — slightly worse than baseline. Heavier regularization doesn't help.","timestamp":1781354879185,"segment":3,"confidence":null,"asi":{"hypothesis":"Lower lr with stronger regularization should generalize better, especially for small classes","verdict":"Worse overall. Western degraded slightly (-1.1pp), accuracy down 1.1pp. Regularization tradeoff not worthwhile.","rollback_reason":"Negative impact on accuracy","next_action_hint":"Try attention-pooled embedding instead of mean pooling, or increase hidden_dim"}}
{"run":29,"commit":"128acc6","metric":0.5785,"metrics":{"f1_central":0.3791,"f1_nav-lab":0.0072,"f1_navarrese":0.4473,"f1_souletin":0.0524,"f1_western":0.7521},"status":"discard","description":"hidden_dim=1024 (1024→512→5), epochs=100. 57.85% — worse than baseline. Bigger MLP overfits.","timestamp":1781354914858,"segment":3,"confidence":null,"asi":{"hypothesis":"Larger hidden_dim (1024) should let the 1280-dim embeddings flow with less bottlenecking","verdict":"Worse. Overfits. 1280→1024→512→5 has too many params for this dataset.","rollback_reason":"Overfitting — lower accuracy","next_action_hint":"Try attention pooling for embeddings instead of mean pooling"}}
{"run":30,"commit":"f2a2c59","metric":0.5801,"metrics":{"f1_central":0.399,"f1_nav-lab":0.0479,"f1_navarrese":0.4566,"f1_souletin":0.0481,"f1_western":0.7614},"status":"discard","description":"mean+std+max pooling (3840-dim) + 2-layer MLP. 58.01% acc but nav-lab F1 4× better (0.048 vs 0.012). Temporal stats help minority dialects.","timestamp":1781356487290,"segment":3,"confidence":null,"asi":{"hypothesis":"Mean+std+max pooling captures temporal distribution of phonetic features, which should help distinguish dialectal prosodic patterns","verdict":"Mixed result. Nav-lab F1 improved 4× (0.012→0.048), navarrese +3.3pp, but overall accuracy dropped 1pp due to western majority class. Frustrating tradeoff — the features ARE better for minority classes but accuracy metric punishes it.","rollback_reason":"Lower accuracy — but concept is promising for minority classes","next_action_hint":"Try class weights WITH mean_std_max pooling to balance accuracy and minority class improvement"}}
{"run":31,"commit":"ba1bd63","metric":0.5964,"metrics":{"f1_central":0.3819,"f1_nav-lab":0.0109,"f1_navarrese":0.4448,"f1_souletin":0.0777,"f1_western":0.7846},"status":"keep","description":"mean_std_max + class_weights: 59.64% (BEST). Western F1 78.5%. Class weights with richer features pushes western higher (+2.3pp vs baseline).","timestamp":1781356530714,"segment":3,"confidence":3.3387096774193723,"asi":{"hypothesis":"Class weights + mean_std_max pooling should balance the accuracy vs minority F1 tradeoff","verdict":"Best accuracy so far (59.64%). Western dominated (+2.3pp). Class weights interacting poorly with mean_std_max features for nav-lab.","next_action_hint":"Keep direction; try with standard mean pooling + class weights as sanity check, then explore attention pooling"}}
{"type":"config","name":"Whisper encoder + MLP — macro F1 optimization for 5-class dialect","metricName":"macro_f1","metricUnit":"","bestDirection":"higher"}
{"run":32,"commit":"c356d63","metric":0.3496,"metrics":{"accuracy":0.6012,"f1_central":0.3921,"f1_nav-lab":0.01,"f1_navarrese":0.4469,"f1_souletin":0.1073,"f1_western":0.7918},"status":"keep","description":"Baseline (macro_f1 metric): mean_std_max + class_weights. Macro F1=0.3496. Western 79.2% F1, navarrese 44.7%, souletin 10.7%.","timestamp":1781356570110,"segment":4,"confidence":null,"asi":{"hypothesis":"Establishing baseline for macro F1 optimization — current best config under new metric"}}
{"run":33,"commit":"ccac1b1","metric":0.3615,"metrics":{"accuracy":0.5973,"f1_central":0.4193,"f1_nav-lab":0,"f1_navarrese":0.474,"f1_souletin":0.1327,"f1_western":0.7767},"status":"keep","description":"Focal loss (gamma=2.0): macro F1=0.362 (+3.4%). Central +2.7pp, navarrese +2.7pp, souletin +2.5pp. Focal loss effectively down-weights western (easy) examples.","timestamp":1781356617125,"segment":4,"confidence":null,"asi":{"hypothesis":"Focal loss down-weights easy (western) examples, focusing gradient on hard minority classes","verdict":"Confirmed: macro F1 +3.4%, three minority classes all improved +2-3pp each. Western compensated by mean_std_max features staying strong at 77.7%.","next_action_hint":"Try stronger focal (gamma=3.0, 4.0) or focal + class_weights combo"}}
{"run":34,"commit":"a328b85","metric":0.3492,"metrics":{"accuracy":0.5998,"f1_central":0.3989,"f1_nav-lab":0,"f1_navarrese":0.4795,"f1_souletin":0.0874,"f1_western":0.7803},"status":"discard","description":"Focal gamma=3.0: macro F1=0.349 (worse than gamma=2.0 at 0.362). Too aggressive — souletin + central dropped. Optimum gamma ≈ 2.","timestamp":1781356665490,"segment":4,"confidence":29.749999999999062,"asi":{"hypothesis":"Higher gamma (3.0) should focus even more on hard examples","verdict":"Too aggressive. Central 39.9% (down from 41.9%), souletin 8.7% (down from 13.3%). Navarrese improved to 48.0% though.","rollback_reason":"Lower macro F1 — gamma=3.0 is too strong for this dataset","next_action_hint":"Try focal gamma=1.0 or gamma=2.0 + dropout=0.4"}}
{"run":35,"commit":"a328b85","metric":0.3431,"metrics":{"accuracy":0.6019,"f1_central":0.3902,"f1_nav-lab":0.0089,"f1_navarrese":0.4448,"f1_souletin":0.0853,"f1_western":0.7863},"status":"discard","description":"Focal gamma=2.0 + dropout=0.5: macro F1=0.343. Higher dropout hurts minority classes (navarrese -3pp, souletin -4.8pp). Regularization needs to be balanced with class representation.","timestamp":1781356705188,"segment":4,"confidence":3.6615384615384166,"asi":{"hypothesis":"Higher dropout (0.5) with focal loss should regularize the model while maintaining minority class focus","verdict":"Worse. Dropout is class-blind and restricts already-limited representations for small classes. Focal loss + dropout=0.3 is better.","rollback_reason":"Higher dropout degrades minority classes","next_action_hint":"Try 3-class reduction (western/central/navarrese) or lower learning rate schedule"}}
{"run":36,"commit":"2435774","metric":0.3445,"metrics":{"accuracy":0.5978,"f1_central":0.4032,"f1_nav-lab":0.0085,"f1_navarrese":0.4534,"f1_souletin":0.0762,"f1_western":0.7797},"status":"discard","description":"Re-run focal gamma=2.0 + mean_std_max: macro F1=0.344 (lower than #33 0.362 — stochastic variance). Committing focal config permanently.","timestamp":1781356849987,"segment":4,"confidence":2.5319148936169937,"asi":{"hypothesis":"Re-establish focal gamma=2.0 + mean_std_max baseline","verdict":"Lower macro F1 (0.344 vs 0.362 from #33). MLP training has non-trivial stochastic variance. Need to either add fixed seed or run multiple seeds and average.","rollback_reason":"Worse than best known (0.362)","next_action_hint":"Add torch.manual_seed(42) for reproducibility, or try halving batch size for more diverse gradient updates"}}
{"type":"config","name":"Merged dataset: balance nav-lab dominance for macro F1","metricName":"macro_f1","metricUnit":"","bestDirection":"higher"}
{"run":37,"commit":"96519d1","metric":0.4327,"metrics":{"f1_central":0.3516,"f1_navarrese":0.0951,"f1_souletin":0.2761,"f1_western":0.5767,"f1_nav-lab":0.8639,"accuracy":0.7389,"epochs":100,"lr":0.0005},"status":"keep","description":"Baseline: merged dataset with current config (focal γ=2.0, lr=5e-4, hidden=512). Nav-lab dominates (0.86), navarrese collapses (0.10)","timestamp":1781455781924,"segment":5,"confidence":null,"asi":{"hypothesis":"Establish merged-dataset baseline before optimization","notes":"Nav-lab 89K vs central 5K = 18:1 imbalance. Navarrese 0.10 is the main problem."}}
{"run":38,"commit":"03c5b3b","metric":0.5051,"metrics":{"f1_central":0.3727,"f1_navarrese":0.2701,"f1_souletin":0.388,"f1_western":0.6771,"f1_nav-lab":0.8177,"accuracy":0.7012,"epochs":100,"lr":0.0005},"status":"keep","description":"Balanced subsample: 10K/class. Macro F1 0.505 (+16.7%). Navarrese 0.27 (+17pp), western 0.68 (+10pp), souletin 0.39 (+11pp)","timestamp":1781456155293,"segment":5,"confidence":null,"asi":{"hypothesis":"Downsampling nav-lab from 89K to 10K balances classes -> recovers minority F1","notes":"Navarrese jumps +17pp (0.10->0.27), western +10pp, souletin +11pp. Nav-lab only drops 4pp. Training 2.5x faster. 50K balanced dataset."}}
{"run":39,"commit":"5a93aba","metric":0.506,"metrics":{"f1_central":0.3401,"f1_navarrese":0.2883,"f1_souletin":0.3811,"f1_western":0.691,"f1_nav-lab":0.8297,"accuracy":0.7149,"epochs":100,"lr":0.0005},"status":"discard","description":"Balanced 10K + gamma=3.0. Macro F1 0.506 (flat). Navarrese 0.29 (+2pp), central drops 0.34 (-3pp)","timestamp":1781456257263,"segment":5,"confidence":80.4444444444434,"asi":{"hypothesis":"gamma=3.0 with balanced subsampling may further penalize nav-lab","rollback_reason":"macro F1 flat (0.506 vs 0.505). Within noise.","next_action_hint":"try gamma=4.0 or class_weights instead of subsampling"}}
{"run":40,"commit":"5a93aba","metric":0.5025,"metrics":{"f1_central":0.3223,"f1_navarrese":0.2935,"f1_souletin":0.4006,"f1_western":0.6758,"f1_nav-lab":0.8204,"accuracy":0.7043,"epochs":100,"lr":0.0005},"status":"discard","description":"Balanced 10K + gamma=4.0. Macro F1 0.5025 (worse). Central drops to 0.32","timestamp":1781456357525,"segment":5,"confidence":41.37142857142789,"asi":{"hypothesis":"gamma=4.0 pushes further penalty on nav-lab","rollback_reason":"macro F1 0.5025 < 0.5051 baseline. Central drops to 0.32. Too aggressive.","next_action_hint":"gamma=2.0 is optimal. Try class_weights instead of focal loss."}}
{"run":41,"commit":"5a93aba","metric":0.5,"metrics":{"f1_central":0.302,"f1_navarrese":0.3137,"f1_souletin":0.3915,"f1_western":0.6746,"f1_nav-lab":0.818,"accuracy":0.6978,"epochs":100,"lr":0.0005},"status":"discard","description":"Balanced 10K + CE + class_weights. Macro F1 0.500 (worse than focal 0.505). Central drops to 0.30","timestamp":1781456450805,"segment":5,"confidence":27.846153846153353,"asi":{"hypothesis":"CE + class_weights might be simpler and equally effective as focal loss","rollback_reason":"macro F1 0.500 vs 0.505 baseline. Navarrese +4pp (0.31) but central -7pp (0.30). Focal is better.","next_action_hint":"keep focal + balanced subsample. Try lower LR or more epochs."}}
{"run":42,"commit":"5a93aba","metric":0.5045,"metrics":{"f1_central":0.3568,"f1_navarrese":0.2764,"f1_souletin":0.3848,"f1_western":0.6834,"f1_nav-lab":0.8211,"accuracy":0.7048,"epochs":150,"lr":0.0005},"status":"discard","description":"Balanced 10K + focal + 150 epochs. Macro F1 0.5045 (flat). 100 epochs sufficient","timestamp":1781456597231,"segment":5,"confidence":35.31707317073082,"asi":{"hypothesis":"150 epochs gives more time for balanced 44K dataset to converge","rollback_reason":"macro F1 0.5045 vs 0.5051 baseline. 100 epochs is sufficient. No gain from more epochs.","next_action_hint":"try lower LR (1e-4) with balanced samplin"}}
{"run":43,"commit":"5a93aba","metric":0.5031,"metrics":{"f1_central":0.3217,"f1_navarrese":0.3041,"f1_souletin":0.3998,"f1_western":0.6858,"f1_nav-lab":0.8042,"accuracy":0.6897,"epochs":100,"lr":0.0001},"status":"discard","description":"Balanced 10K + focal + lr=1e-4. Macro F1 0.503 (slightly worse). lr=5e-4 still optimal","timestamp":1781456697584,"segment":5,"confidence":36.199999999999974,"asi":{"hypothesis":"lr=1e-4 might generalize better with balanced data","rollback_reason":"macro F1 0.503 vs 0.505. Slightly worse. lr=5e-4 still optimal.","next_action_hint":"try 5K subsample (more aggressive balancing) or 20K (less aggressive)"}}
{"run":44,"commit":"5a93aba","metric":0.4955,"metrics":{"f1_central":0.271,"f1_navarrese":0.3043,"f1_souletin":0.4055,"f1_western":0.6874,"f1_nav-lab":0.8093,"accuracy":0.6926,"epochs":100,"lr":0.0005},"status":"discard","description":"Balanced 5K + focal. Macro F1 0.495 (worse). Central collapses to 0.27","timestamp":1781456763338,"segment":5,"confidence":28.392156862745143,"asi":{"hypothesis":"5K subsample balances even harder","rollback_reason":"macro F1 0.495 < 0.505. Central drops to 0.27. 10K is the sweet spot.","next_action_hint":"settle on 10K balanced. Try dropout=0.5 for regularization."}}
{"run":45,"commit":"5a93aba","metric":0.4945,"metrics":{"f1_central":0.2898,"f1_navarrese":0.276,"f1_souletin":0.413,"f1_western":0.6793,"f1_nav-lab":0.8144,"accuracy":0.6975,"epochs":100,"lr":0.0005},"status":"discard","description":"Balanced 10K + focal + dropout=0.5. Macro F1 0.494 (worse). Central drops to 0.29","timestamp":1781456868391,"segment":5,"confidence":27.846153846153353,"asi":{"hypothesis":"dropout=0.5 regularizes nav-lab overfitting","rollback_reason":"macro F1 0.494 < 0.505. Higher dropout = less capacity = hurts central. dropout=0.3 optimal.","next_action_hint":"try 20K subsample (less aggressive, more nav-lab data)"}}
{"run":46,"commit":"5a93aba","metric":0.4972,"metrics":{"f1_central":0.3519,"f1_navarrese":0.2505,"f1_souletin":0.3718,"f1_western":0.6661,"f1_nav-lab":0.8455,"accuracy":0.7288,"epochs":100,"lr":0.0005},"status":"discard","description":"Balanced 20K + focal. Macro F1 0.497 (worse). Tilts toward nav-lab (0.85)","timestamp":1781456992704,"segment":5,"confidence":18.329113924050596,"asi":{"hypothesis":"20K subsample = less aggressive balancing, more nav-lab data for better generalization","rollback_reason":"macro F1 0.497 < 0.505. Tilts back toward nav-lab (0.85). 10K is optimal balance point.","next_action_hint":"10K confirmed optimal. Try focal + class_weights together."}}
{"run":47,"commit":"5a93aba","metric":0.4924,"metrics":{"f1_central":0.3247,"f1_navarrese":0.2516,"f1_souletin":0.411,"f1_western":0.654,"f1_nav-lab":0.8209,"accuracy":0.701,"epochs":100,"lr":0.0005},"status":"discard","description":"Balanced 10K + focal + class_weights. Macro F1 0.492 (worse). Dual regularization hurts","timestamp":1781457104140,"segment":5,"confidence":16.088888888888878,"asi":{"hypothesis":"focal + class_weights combine sample-level and class-level balancing","rollback_reason":"macro F1 0.492 < 0.505. Dual regularization over-constrains. One mechanism is enough.","next_action_hint":"Best so far: 10K balanced + focal γ=2.0. Try 3-layer MLP with balanced data (may not overfit now)."}}
{"run":48,"commit":"5a93aba","metric":0.5051,"metrics":{"f1_central":0.3727,"f1_navarrese":0.2701,"f1_souletin":0.388,"f1_western":0.6771,"f1_nav-lab":0.8177,"accuracy":0.7012,"epochs":100,"lr":0.0005},"status":"discard","description":"Balanced 10K + focal + 3-layer MLP. Macro F1 0.505 (identical to 2-layer)","timestamp":1781457227027,"segment":5,"confidence":18.329113924050596,"asi":{"hypothesis":"3-layer MLP with balanced data might capture richer class boundaries","rollback_reason":"macro F1 0.5051 = identical to 2-layer 0.5051. No benefit from extra capacity.","next_action_hint":"2-layer confirmed. Try hidden_dim=1024 with balanced data (might benefit with more capacity on balanced data)."}}
{"run":49,"commit":"5a93aba","metric":0.4884,"metrics":{"f1_central":0.2965,"f1_navarrese":0.2873,"f1_souletin":0.3858,"f1_western":0.6621,"f1_nav-lab":0.8102,"accuracy":0.6928,"epochs":100,"lr":0.0005},"status":"discard","description":"Balanced 10K + focal + hidden=1024. Macro F1 0.488 (worse). Overfits","timestamp":1781457332490,"segment":5,"confidence":14.196078431372571,"asi":{"hypothesis":"hidden_dim=1024 with balanced 10K data – more capacity without becoming nav-lab-biased","rollback_reason":"macro F1 0.488 < 0.505. Overfits even on balanced data. 512 is optimal.","next_action_hint":"Conclude: 10K balanced + focal γ=2.0 + hidden=512 + lr=5e-4. Document final config."}}
{"run":50,"commit":"1fdd949","metric":0.5099,"metrics":{"f1_central":0.3304,"f1_navarrese":0.3095,"f1_souletin":0.4038,"f1_western":0.6868,"f1_nav-lab":0.8191,"accuracy":0.7052,"epochs":100,"lr":0.0005},"status":"keep","description":"Balanced 10K + CE (no focal). Macro F1 0.5099 (BEST!). Navarrese 0.31, souletin 0.40","timestamp":1781457426471,"segment":5,"confidence":17.545454545454497,"asi":{"hypothesis":"Balanced subsampling alone (no focal) — maybe the subsampling is sufficient and focal is redundant","notes":"Best macro F1 so far (0.5099). Navarrese 0.31, souletin 0.40 (both best). Balanced subsampling alone handles imbalance; focal becomes redundant regularizer."}}
{"run":51,"commit":"c6c26b8","metric":0.5055,"metrics":{"f1_central":0.3105,"f1_navarrese":0.3213,"f1_souletin":0.3917,"f1_western":0.6879,"f1_nav-lab":0.8162,"accuracy":0.7007,"epochs":100,"lr":0.001},"status":"discard","description":"Balanced 10K + lr=1e-3. Macro F1 0.5055 (flat). Central drops to 0.31","timestamp":1781457561641,"segment":5,"confidence":22.0571428571425,"asi":{"hypothesis":"lr=1e-3 with balanced 10K data — higher LR may find better minima on smaller dataset","rollback_reason":"macro F1 0.5055 < 0.5099 best. Central drops to 0.31. 5e-4 still optimal.","next_action_hint":"try batch_size=32 (smaller batches = noisier gradients for better generalization on 44K dataset)"}}
{"run":52,"commit":"c6c26b8","metric":0.5103,"metrics":{"f1_central":0.3243,"f1_navarrese":0.3089,"f1_souletin":0.4019,"f1_western":0.6928,"f1_nav-lab":0.8235,"accuracy":0.7112,"epochs":100,"lr":0.0005},"status":"discard","description":"Balanced 10K + batch=32. Macro F1 0.5103 (flat). Acc 0.711 (slightly better)","timestamp":1781457720929,"segment":5,"confidence":17.545454545454497,"asi":{"hypothesis":"batch_size=32 — noisier gradients help escape nav-lab local minima on balanced 44K dataset","rollback_reason":"macro F1 0.5103 vs 0.5099 best — within noise (<0.1%). Accuracy slightly better (0.711 vs 0.705).","next_action_hint":"Try weight_decay sweep (1e-3, 1e-2) — current is 1e-4. More regularization may help with 10K samples/class."}}
{"run":53,"commit":"c6c26b8","metric":0.5073,"metrics":{"f1_central":0.3504,"f1_navarrese":0.2949,"f1_souletin":0.3985,"f1_western":0.6805,"f1_nav-lab":0.8123,"accuracy":0.7017,"epochs":100,"lr":0.0005},"status":"discard","description":"Balanced 10K + oversample minority. Macro F1 0.507 (worse). Repeated samples = noise","timestamp":1781458062992,"segment":5,"confidence":18.380952380952472,"asi":{"hypothesis":"Oversample central/navarrese/western to 10K for exact class balance","rollback_reason":"macro F1 0.507 < 0.510. Repeating samples (central 2×, navarrese 1.1×) adds noise not signal.","next_action_hint":"Plateau at 0.509-0.510. Try crossentropy + class_weights on balanced 10K (without focal, just subsample + weights). Different from the earlier focal+weights test."}}
{"run":54,"commit":"c6c26b8","metric":0.4927,"metrics":{"f1_central":0.2962,"f1_navarrese":0.2602,"f1_souletin":0.4203,"f1_western":0.6682,"f1_nav-lab":0.8186,"accuracy":0.7016,"epochs":100,"lr":0.001},"status":"discard","description":"Balanced 10K + SGD lr=1e-3. Macro F1 0.493 (worse than AdamW 0.510)","timestamp":1781458248335,"segment":5,"confidence":15.287128712871299,"asi":{"hypothesis":"SGD generalizes better than AdamW on small datasets","rollback_reason":"macro F1 0.493 (lr=1e-3) and 0.454 (lr=1e-2) — both much worse than AdamW 0.510. Adaptive optimizer is needed for this problem.","next_action_hint":"Plateau at 0.509-0.510 with current architecture + data. Largest remaining gain is attention pooling (needs re-extraction). Accept this as final."}}
{"run":55,"commit":"17e3072","metric":0.5058,"metrics":{"f1_central":0.3473,"f1_navarrese":0.2646,"f1_souletin":0.4108,"f1_western":0.6865,"f1_nav-lab":0.8196,"accuracy":0.7043,"epochs":100,"lr":0.0005},"status":"discard","description":"Mixup α=0.2 on balanced 10K. Macro F1 0.506. Central +2pp, navarrese -5pp","timestamp":1781458393546,"segment":5,"confidence":18.380952380952472,"asi":{"hypothesis":"Mixup augmentation (α=0.2) on 1280-dim embeddings — creates interpolated virtual examples bridging dialect continua, helping ambiguous central/navarrese","rollback_reason":"macro F1 0.5058 < 0.5099 best. Central +2pp (0.35) but navarrese -5pp (0.26). Mixup blurs the central↔navarrese boundary.","next_action_hint":"Try higher mixup alpha (0.4, 1.0) — more mixing might regularize navarrese or try label smoothing (0.1) instead of mixup."}}
