{"type":"config","name":"azpieuskalki 12-class F1 optimization","metricName":"weighted_f1","metricUnit":"f1_score","bestDirection":"higher"}
{"run":1,"commit":"36c8d8f","metric":0.823128,"metrics":{"macro_f1":0.73237,"bottom5_mean_f1":0.616895,"bottom5_min_f1":0.571429,"overall_accuracy":0.825225,"train_time":119.9},"status":"keep","description":"Baseline: loss=ns, dim=200, epoch=75, lr=0.2, wordNgrams=2, minn=2, maxn=6, minCount=1, no oversample. 12 classes, weighted_f1=0.8231, bottom5_mean=0.6169.","timestamp":1781261734352,"segment":0,"confidence":null,"asi":{"hypothesis":"Baseline run to establish reference for optimization loop.","config":"loss=ns,dim=200,epoch=75,lr=0.2,ngrams=2,minn=2,maxn=6,minCount=1,oversample=None","weakest_classes":["nafar-hego-sartaldea_0.57","nafar-erdigunea_0.57","mendebal-sartaldea_0.67","naflap-sartaldea_0.65","ekialde-nafarra_0.62"],"bottom5_gap_to_0.70":"nafar-hego-sartaldea/nafar-erdigunea need +13pp, the other 3 need +3-8pp"}}
{"run":2,"commit":"36c8d8f","metric":0.822028,"metrics":{"macro_f1":0.733857,"bottom5_mean_f1":0.622704,"bottom5_min_f1":0.580645,"overall_accuracy":0.82471,"train_time":159.7},"status":"discard","description":"loss=ova: weighted_f1=0.8220 (-0.0011 vs baseline). Slightly worse overall, bottom5_mean +0.0058. nafar-erdigunea +1.4pp, ekialde-nafarra +0.6pp but zuberera -0.36pp. Small gains on weak classes but not worth 42s slower training.","timestamp":1781261906128,"segment":0,"confidence":null,"asi":{"hypothesis":"ova loss (one-vs-all binary CE) should help imbalanced classes","verdict":"marginal loss, slows training significantly (+42s), bottom5 improves but overall weighted_f1 drops slightly","next_action_hint":"try loss=hs (hierarchical softmax) since classes have natural hierarchy","rollback_reason":"worse weighted_f1 and slower training"}}
{"run":3,"commit":"36c8d8f","metric":0.780512,"metrics":{"macro_f1":0.648637,"bottom5_mean_f1":0.481913,"bottom5_min_f1":0.385965,"overall_accuracy":0.781596,"train_time":143.8},"status":"discard","description":"loss=hs: weighted_f1=0.7805 (-0.0426 vs baseline). Catastrophic across weak classes: nafar-hego-sartaldea 0.39, nafar-erdigunea 0.51, naflap-sartaldea 0.48. HS is designed for large output spaces but destroys minority class performance here.","timestamp":1781262058536,"segment":0,"confidence":null,"asi":{"hypothesis":"hierarchical softmax helps imbalanced hierarchy","verdict":"worse than ns on every metric. HS's tree structure likely puts minority classes deep in the traversal, increasing error propagation","next_action_hint":"stick with ns loss, try oversampling to directly address class imbalance instead","rollback_reason":"catastrophic -4.3pp weighted_f1, bottom5 drops from 0.62 to 0.48"}}
{"run":4,"commit":"36c8d8f","metric":0.794511,"metrics":{"macro_f1":0.71172,"bottom5_mean_f1":0.602862,"bottom5_min_f1":0.548148,"overall_accuracy":0.792021,"train_time":121.8},"status":"discard","description":"oversample_factor=4: weighted_f1=0.7945 (-0.0286). Oversampling hurt everywhere — even top classes degraded (mendebal-sortaldea 88.4→85.1%, zuberera 95.4→94.3%). Known pattern from prior experiments: flat oversampling collapses accuracy. Need targeted/minimal oversampling.","timestamp":1781262189598,"segment":0,"confidence":null,"asi":{"hypothesis":"oversample_factor=4 balances classes more aggressively","verdict":"catastrophic loss across the board, confirms flat oversampling is harmful for this dataset. Top classes suffer from noise injection during oversampling of minority classes","next_action_hint":"try dim=300 for more model capacity to handle class disparity without oversampling, or try wordNgrams=3 for more contextual signal","rollback_reason":"massive -2.9pp weighted_f1 loss"}}
{"run":5,"commit":"36c8d8f","metric":0.822296,"metrics":{"macro_f1":0.731906,"bottom5_mean_f1":0.616527,"bottom5_min_f1":0.564841,"overall_accuracy":0.824453,"train_time":196.6},"status":"discard","description":"dim=300: weighted_f1=0.8223 (-0.0008). Identical to dim=200 (0.8231), within noise. Training time doubled (120→197s). More capacity doesn't help the class imbalance problem.","timestamp":1781262394283,"segment":0,"confidence":null,"asi":{"hypothesis":"dim=300 gives model more capacity to handle 12-class disparity","verdict":"no improvement, within noise. The bottleneck is not model capacity but data quality/quantity for minority classes","next_action_hint":"try wordNgrams=3 — trigrams might capture dialectal phrasing better than bigrams, helping distinguish closely-related classes like nafar variants","rollback_reason":"identical performance for 2x cost"}}
{"type":"config","name":"Mendebal-sartaldea data expansion + retrain","metricName":"weighted_f1","metricUnit":"","bestDirection":"higher"}
{"run":6,"commit":"9c3918d","metric":0.822877,"metrics":{"macro_f1":0.751564,"bottom5_mean_f1":0.648763,"bottom5_min_f1":0.609053,"overall_accuracy":0.823731,"train_time":120.3},"status":"keep","description":"baseline: mendebal-sartaldea data expansion (+167 passages from 19 new towns). F1 stayed flat (~0.823) — new data didn't hurt but also didn't immediately help the Bizkaian confusion.","timestamp":1781263946635,"segment":1,"confidence":null,"asi":{"hypothesis":"Adding 19 new mendebal-sartaldea towns (~167 passages, ~100-150 clean sentences) would increase class representation and help distinguish Western Bizkaian from Eastern Bizkaian","new_passages":167,"new_towns":19,"mendebal_sartaldea_f1":"not shown in this run","result":"weighted F1 stayed flat at 0.823 — the new data is small (~7% increase) and may need +epoch or different loss to leverage it"}}
{"run":7,"commit":"9c3918d","metric":0.823137,"metrics":{"macro_f1":0.753552,"bottom5_mean_f1":0.65448,"bottom5_min_f1":0.625,"overall_accuracy":0.824098,"train_time":108.6},"status":"discard","description":"wordNgrams=3: weighted_f1=0.8231 vs baseline 0.8230. Trigrams add no value — dialectal markers are already captured at bigram level. Training was actually faster (108s vs 120s).","timestamp":1781282398717,"segment":1,"confidence":null,"asi":{"hypothesis":"wordNgrams=3 captures dialectal multi-word phrases better than bigrams","verdict":"no improvement, trigrams don't help for these Basque subdialects — n-gram level dialectal markers are short (1-2 words)","rollback_reason":"identical to baseline within noise","next_action_hint":"try minCount=2 or minCount=5 to filter noise words that confuse minority classes"}}
{"run":8,"commit":"9c3918d","metric":0.822452,"metrics":{"macro_f1":0.751838,"bottom5_mean_f1":0.648838,"bottom5_min_f1":0.605042,"overall_accuracy":0.823242,"train_time":107.2},"status":"discard","description":"minCount=2: weighted_f1=0.8225 (-0.0004). Filtering singletons slightly hurts — rare dialectal words carry signal for minority classes.","timestamp":1781282514272,"segment":1,"confidence":null,"asi":{"hypothesis":"minCount=2 filters noise words that mislead minority classes","verdict":"slightly worse, rare words are dialectal signal not noise for Basque","rollback_reason":"worse than baseline","next_action_hint":"try minn=3,maxn=8 for longer morphological subword units"}}
{"run":9,"commit":"9c3918d","metric":0.820735,"metrics":{"macro_f1":0.751057,"bottom5_mean_f1":0.644692,"bottom5_min_f1":0.591304,"overall_accuracy":0.822263,"train_time":110},"status":"discard","description":"minn=3,maxn=8: weighted_f1=0.8207 (-0.0022). Wider char n-gram range hurts — minn=2 is needed for Basque short morphological markers (case endings, verb inflections). zuberera dropped from 0.95 to 0.94.","timestamp":1781282632388,"segment":1,"confidence":null,"asi":{"hypothesis":"minn=3,maxn=8 captures longer morphological segments more specific to dialects","verdict":"worse, losing minn=2 removes important short Basque morphemes (case markers, aspect suffixes) that carry dialect signal","rollback_reason":"worse than baseline","next_action_hint":"try epoch=150,lr=0.1 — longer training with lower LR for better minority class convergence"}}
{"run":10,"commit":"9c3918d","metric":0.822135,"metrics":{"macro_f1":0.749917,"bottom5_mean_f1":0.644603,"bottom5_min_f1":0.613445,"overall_accuracy":0.822997,"train_time":231.3},"status":"discard","description":"epoch=150,lr=0.1: weighted_f1=0.8221 (-0.0008). Double training time (231s), no improvement. More epochs don't help — model converges at ~75 epochs with current data.","timestamp":1781282873706,"segment":1,"confidence":null,"asi":{"hypothesis":"epoch=150,lr=0.1 gives more training time for minority classes to converge","verdict":"no improvement, model already converged at epoch=75. Longer training just wastes time. The bottleneck is data scarcity for Nafarroa minorities, not training duration","rollback_reason":"identical within noise, 2x cost","next_action_hint":"try lr=0.05 — very low LR might find better minima for minority classes, or try targeted oversampling on bottom-3 only instead of flat oversampling"}}
{"run":11,"commit":"9c3918d","metric":0.821025,"metrics":{"macro_f1":0.749882,"bottom5_mean_f1":0.643114,"bottom5_min_f1":0.61157,"overall_accuracy":0.821896,"train_time":116.9},"status":"discard","description":"lr=0.3: weighted_f1=0.8210 (-0.0019). Higher LR slightly worse — 0.2 is the sweet spot for this data size.","timestamp":1781283000411,"segment":1,"confidence":null,"asi":{"hypothesis":"lr=0.3 explores more aggressively, helping minority classes escape local minima","verdict":"slightly worse, lr=0.2 is optimal. Hyperparameter tuning is exhausted — need architecture change (loss=ova on new data, or two-stage)","rollback_reason":"worse than baseline","next_action_hint":"retry loss=ova with the expanded dataset — the class distribution changed, ova might work better now"}}
{"run":12,"commit":"9c3918d","metric":0.822607,"metrics":{"macro_f1":0.751805,"bottom5_mean_f1":0.64878,"bottom5_min_f1":0.621277,"overall_accuracy":0.823976,"train_time":120.9},"status":"discard","description":"loss=ova on expanded dataset: weighted_f1=0.8226 (-0.0003 vs baseline ns). Still within noise. Ova doesn't outperform ns even with more mendebal-sartaldea data. ns remains the best loss function.","timestamp":1781283128804,"segment":1,"confidence":null,"asi":{"hypothesis":"loss=ova with expanded mendebal-sartaldea data might now outperform ns since bottom classes changed","verdict":"still within noise of ns baseline. ova is not the solution for this dataset","rollback_reason":"slightly worse than ns baseline","next_action_hint":"keep ns loss, quantize model. Next big move: two-stage classifier architecture"}}
{"run":13,"commit":"9c3918d","metric":0.824487,"metrics":{"macro_f1":0.759351,"bottom5_mean_f1":0.664613,"bottom5_min_f1":0.623894,"overall_accuracy":0.825321,"train_time":149},"status":"keep","description":"targeted oversample factor=4 (bottom-half only): weighted_f1=0.8245 (+0.0016 vs baseline). Bottom classes improved without top class degradation. naflap-sartaldea +3.5pp, nafar-hego-sartaldea +2.6pp, naflap-sortaldea +2.0pp. Key insight: flat oversampling is harmful, targeted is beneficial.","timestamp":1781283850135,"segment":1,"confidence":3.2135728542912303,"asi":{"hypothesis":"targeted oversampling (only bottom-half classes) avoids noise injection into strong classes while boosting weak ones","verdict":"works — +0.0016 weighted_f1, +1.8pp bottom5_mean. flat oversampling at factor=4 was -0.029 while targeted at -4 is +0.0016","technique":"negative oversample_factor triggers targeted mode: only oversample classes below median count","next_action_hint":"try factor=-3 (more aggressive) or factor=-6 (gentler) to optimize the sweet spot"}}
{"run":14,"commit":"9c3918d","metric":0.825143,"metrics":{"macro_f1":0.763753,"bottom5_mean_f1":0.677369,"bottom5_min_f1":0.635965,"overall_accuracy":0.825933,"train_time":202.2},"status":"keep","description":"targeted oversample factor=2 (more aggressive): weighted_f1=0.8251 (+0.0022 vs baseline). Better than factor=-4. naflap-sartaldea now 0.703 (+4.6pp from baseline!), nafar-sortaldea 0.705. Bottom5_mean=0.677 (+3.0pp). Top classes stable.","timestamp":1781284063332,"segment":1,"confidence":4.275471698112944,"asi":{"hypothesis":"more aggressive targeted oversampling (factor=-2) boosts minority classes more","verdict":"better than -4. Trend: lower factor = more aggressive oversampling = better bottom class performance. Top classes intact","next_action_hint":"try factor=-1 (ultra-aggressive: all below-median classes boosted to max/1 level)"}}
{"run":15,"commit":"9c3918d","metric":0.824495,"metrics":{"macro_f1":0.764471,"bottom5_mean_f1":0.678044,"bottom5_min_f1":0.640523,"overall_accuracy":0.825199,"train_time":298.2},"status":"discard","description":"targeted oversample factor=1 (max aggressive): weighted_f1=0.8245 vs -2's 0.8251. Too aggressive — top classes start to degrade (zuberera -0.2pp, nafar-ipar-sartaldea -0.7pp). Sweet spot is factor=-2.","timestamp":1781284371756,"segment":1,"confidence":1.9500860585197912,"asi":{"hypothesis":"factor=-1 ultra-aggressive targeted oversampling","verdict":"worse than -2. Too much oversampling injects noise. Sweet spot: -2 > -4 > -1","rollback_reason":"worse than factor=-2","next_action_hint":"try factor=-2 with epoch=100 — more training time for the larger oversampled dataset"}}
{"run":16,"commit":"9c3918d","metric":0.825485,"metrics":{"macro_f1":0.763737,"bottom5_mean_f1":0.675793,"bottom5_min_f1":0.637555,"overall_accuracy":0.8263,"train_time":270.3},"status":"keep","description":"targeted oversample factor=-2 + epoch=100: weighted_f1=0.8255 (+0.0026 vs baseline). Best result so far. Accuracy 0.826. naflap-sartaldea 0.695, nafar-sortaldea 0.700, bottom5_min=0.638. More epochs on oversampled data gives small additional gain.","timestamp":1781284650867,"segment":1,"confidence":1.619875776397549,"asi":{"hypothesis":"factor=-2 with epoch=100 gives oversampled data more training time","verdict":"best result yet. +0.0003 over factor=-2 epoch=75. Gains are diminishing but direction is right","best_config":"loss=ns, dim=200, epoch=100, lr=0.2, wordNgrams=2, minn=2, maxn=6, minCount=1, targeted_oversample=-2"}}
{"type":"config","name":"Baztan data injection + targeted oversampling","metricName":"weighted_f1","metricUnit":"f1_score","bestDirection":"higher"}
{"run":17,"commit":"36c8d8f","metric":0.814453,"metrics":{"macro_f1":0.736282,"bottom5_mean_f1":0.621315,"bottom5_min_f1":0.552885,"overall_accuracy":0.815666,"train_time":103.6},"status":"keep","description":"baseline: Sakana+Baztan injection, no oversampling. weighted_f1=0.8145. New data helps nafar-hego-sartaldea (+3pp) and mendebal-sartaldea stable, but cross-confusion hurts ekialde-nafarra (-5.9pp) and nafar-erdigunea (-5.7pp).","timestamp":1781291278572,"segment":2,"confidence":null,"asi":{"hypothesis":"Baseline with Sakana (53) + Baztan (853) external corpora injected. No oversampling, default hyperparams."}}
{"run":18,"commit":"36c8d8f","metric":0.818295,"metrics":{"macro_f1":0.747359,"bottom5_mean_f1":0.645669,"bottom5_min_f1":0.57619,"overall_accuracy":0.819396,"train_time":232.9},"status":"discard","description":"targeted_oversample=-2, epoch=100 on new data: weighted_f1=0.8183. Baztan injection (+853) helps nafar-sortaldea (+0.4pp) and nafar-hego-sartaldea (+2.4pp) but cross-confuses nafar-erdigunea (-6.4pp) and ekialde-nafarra (-1.3pp).","timestamp":1781291525143,"segment":2,"confidence":null,"asi":{"hypothesis":"Same best config (targeted_oversample=-2, epoch=100) with new data (Sakana+Baztan injection)","verdict":"weighted_f1=0.8183, worse than 0.8255 on old data. nafar-erdigunea collapsed (-6.4pp). Baztan lexical signals cross-confuse other Nafarroa classes.","next_action_hint":"Try epoch=75 (less training on oversampled Baztan data to reduce cross-confusion) or targeted_oversample=-4 (less aggressive) or use the oversample_factor to specifically target nafar-erdigunea and ekialde-nafarra instead of bottom-half"}}
{"run":19,"commit":"36c8d8f","metric":0.81797,"metrics":{"macro_f1":0.747815,"bottom5_mean_f1":0.646822,"bottom5_min_f1":0.587112,"overall_accuracy":0.819155,"train_time":174.2},"status":"discard","description":"targeted_oversample=-2, epoch=75 on new data: 0.8180. Pattern clear: Baztan generic Nafarroa markers confuse other Nafarroa classes. Need to filter for Baztan-specific features only.","timestamp":1781291710902,"segment":2,"confidence":null,"asi":{"hypothesis":"targeted_oversample=-2, epoch=75 on Baztan-injected data","verdict":"Same pattern: nafar-sortaldea +1.5pp, nafar-hego-sartaldea +1.6pp, but ekialde-nafarra -2pp and nafar-erdigunea still low. Problem: Baztan texts use generic Nafarroa lexical markers (erran, bertze, guti) which confuse the model across Nafarroa classes.","next_action_hint":"Filter Baztan examples to keep only sentences with Baztan-SPECIFIC markers (zaben, allatu, galdin, dauku, zaut, untako, gaitzin) — drop sentences that only use generic Nafarroa features. This should reduce cross-contamination."}}
{"run":20,"commit":"02c3375","metric":0.821989,"metrics":{"macro_f1":0.7528,"bottom5_mean_f1":0.656783,"bottom5_min_f1":0.610169,"overall_accuracy":0.822926,"train_time":220.7},"status":"discard","description":"Best config (targeted_oversample=-2, epoch=100) on main: 0.8220 (vs old 0.8255). ekialde-nafarra -2.6pp (variance). This is likely noise — re-running to confirm.","timestamp":1781292275540,"segment":2,"confidence":null,"asi":{"hypothesis":"Reproduce best config (targeted_oversample=-2, epoch=100) on clean main with Sakana injection","verdict":"0.8220, below previous 0.8255. ekialde-nafarra dropped -2.6pp — likely stochastic variance from random seed. This is within the confidence noise floor (~0.003).","next_action_hint":"Run again to check if this is reproducible or noise. Then try: (1) add wordNgrams=3 to the best config — maybe with oversampling the extra context helps, (2) try minCount=1 with autotune to see if it finds better params"}}
{"run":21,"commit":"02c3375","metric":0.824269,"metrics":{"macro_f1":0.762944,"bottom5_mean_f1":0.67503,"bottom5_min_f1":0.637363,"overall_accuracy":0.825076,"train_time":228.1},"status":"discard","description":"Same config as best (targeted_oversample=-2, epoch=100): 0.8243. Confirms noise floor of ~0.002. Good seed: ekialde-nafarra 0.673, nafar-erdigunea 0.637.","timestamp":1781292515777,"segment":2,"confidence":null,"asi":{"hypothesis":"Reproduce best config to confirm noise level","verdict":"0.8243 — within noise of 0.8255. Confirmed Sakana injection works (+3pp on nafar-hego-sartaldea). This seed got lucky on ekialde-nafarra (0.673 vs 0.61). The 0.8220 run was a bad seed.","noise_floor":"+/- 0.002 for this dataset with this config","best_seed_classes":"ekialde-nafarra=0.673, naflap-sortaldea=0.746, nafar-hego-sartaldea=0.669"}}
{"run":22,"commit":"02c3375","metric":0.824214,"metrics":{"macro_f1":0.761516,"bottom5_mean_f1":0.673102,"bottom5_min_f1":0.637363,"overall_accuracy":0.825076,"train_time":171.1},"status":"discard","description":"targeted_oversample=-2, epoch=75: 0.8242. Same as epoch=100 (0.8243) but 57s faster. epoch=75 is the sweet spot.","timestamp":1781292695675,"segment":2,"confidence":null,"asi":{"hypothesis":"epoch=75 with Sakana injection gives same F1 as epoch=100","verdict":"0.8242 at 171s vs 0.8243 at 228s. Confirmed epoch=75 is optimal. Sakana data doesn't need extra epochs."}}
{"run":23,"commit":"02c3375","metric":0.82324,"metrics":{"macro_f1":0.758137,"bottom5_mean_f1":0.664486,"bottom5_min_f1":0.629712,"overall_accuracy":0.824098,"train_time":143.8},"status":"discard","description":"targeted_oversample=-3: 0.8232. Factor=-2 is the sweet spot. -3 is between -2 and -4 and performs accordingly.","timestamp":1781292847152,"segment":2,"confidence":null,"asi":{"hypothesis":"Factor=-3 on targeted oversampling (between -2 and -4)","verdict":"0.8232 — worse than -2 (0.8242). Sweet spot confirmed at -2."}}
{"run":24,"commit":"a9502d5","metric":0.825442,"metrics":{"macro_f1":0.764362,"bottom5_mean_f1":0.674613,"bottom5_min_f1":0.631347,"overall_accuracy":0.826177,"train_time":180.1},"status":"keep","description":"wordNgrams=3 + targeted_oversample=-2: weighted_f1=0.8254 (NEW BEST!). Trigrams + oversampling is a strong combo: naflap-sartaldea +6pp, nafar-hego-sartaldea +2pp.","timestamp":1781293037855,"segment":2,"confidence":4.9036144578313525,"asi":{"hypothesis":"wordNgrams=3 with targeted_oversample=-2 should capture longer dialectal phrases better, especially with Sakana data added","verdict":"NEW BEST: 0.8254 (+0.0012). naflap-sartaldea +6pp (0.698→0.759), nafar-hego-sartaldea +2pp (0.663→0.689). Trigrams interact positively with oversampling — more context helps distinguish closely-related Nafarroa classes when they're oversampled.","next_action_hint":"Try wordNgrams=3 + epoch=100 to see if trigrams need more training time, or wordNgrams=3 + factor=-1 (more aggressive oversampling)"}}
{"type":"config","name":"Whisper encoder + MLP dialect classifier — 5-class Basque dialect accuracy","metricName":"accuracy","metricUnit":"","bestDirection":"higher"}
{"run":25,"commit":"c8532ae","metric":0.5757,"metrics":{"f1_central":0.3856,"f1_nav-lab":0.0145,"f1_navarrese":0.4233,"f1_souletin":0.0844,"f1_western":0.7493},"status":"keep","description":"Baseline: frozen Whisper encoder + 2-layer MLP (512→256→5), lr=1e-3, epochs=50, dropout=0.3. Western 74.9% F1, navarrese 42.3%, central 38.6%.","timestamp":1781354753859,"segment":3,"confidence":null,"asi":{"hypothesis":"Frozen Whisper encoder embeddings + 2-layer MLP baseline — establishes starting point for further optimization"}}
