{"run":56,"commit":"17e3072","metric":0.496,"metrics":{"f1_central":0.291,"f1_navarrese":0.276,"f1_souletin":0.4165,"f1_western":0.6734,"f1_nav-lab":0.823,"accuracy":0.7046,"epochs":100,"lr":0.0005},"status":"discard","description":"Label smoothing 0.1 on balanced 10K. Macro F1 0.496. Central + souletin worse","timestamp":1781458503320,"segment":5,"confidence":15.287128712871299,"asi":{"hypothesis":"Label smoothing (0.1) prevents overconfidence in nav-lab, helping minority classes","rollback_reason":"macro F1 0.496 < 0.510. Label smoothing softens all classes equally — it doesn't discriminate between well-represented and under-represented classes. Central drops to 0.29.","next_action_hint":"Try higher dropout=0.4 (between current 0.3 and bad 0.5) — maybe gentle increase helps. Or try cosine embedding approach with class prototypes."}}
{"run":57,"commit":"564bc98","metric":0.5193,"metrics":{"f1_central":0.3918,"f1_navarrese":0.321,"f1_souletin":0.3929,"f1_western":0.6733,"f1_nav-lab":0.8174,"accuracy":0.7033,"epochs":100,"lr":0.0005},"status":"keep","description":"hidden_dim=768 on balanced 10K. Macro F1 0.5193 (BEST!). Central +6pp (0.39)","timestamp":1781458597143,"segment":5,"confidence":14.677966101694876,"asi":{"hypothesis":"hidden_dim=768 — sweet spot between 512 (not enough capacity for 5-class geometry) and 1024 (overfitting).","notes":"Central 0.33→0.39 (+6pp!), navarrese 0.31→0.32 (best). Western -1.6pp. Macro F1 0.519 (+1.9% over previous best). 768 may give enough capacity to separate central's 658-town diversity."}}
{"run":58,"commit":"564bc98","metric":0.5173,"metrics":{"f1_central":0.3708,"f1_navarrese":0.2972,"f1_souletin":0.4209,"f1_western":0.6816,"f1_nav-lab":0.8163,"accuracy":0.7045,"epochs":100,"lr":0.0005},"status":"discard","description":"hidden_dim=768 + dropout=0.4. Macro F1 0.5173. Central drops 2pp from 768+0.3","timestamp":1781458687042,"segment":5,"confidence":13.746031746031807,"asi":{"hypothesis":"dropout=0.4 with hidden_dim=768 — more regularization for larger model","rollback_reason":"macro F1 0.5173 < 0.5193. Central drops to 0.37 (-2pp). Dropout=0.3 is optimal even at hidden_dim=768.","next_action_hint":"Try hidden_dim=896 (between 768 and 1024) or hidden_dim=784 to further tune."}}
{"run":59,"commit":"564bc98","metric":0.4947,"metrics":{"f1_central":0.3236,"f1_navarrese":0.2827,"f1_souletin":0.3818,"f1_western":0.6703,"f1_nav-lab":0.8149,"accuracy":0.6974,"epochs":100,"lr":0.0005},"status":"discard","description":"hidden_dim=784 on balanced 10K. Macro F1 0.495 (worse). 768 is peak","timestamp":1781458862568,"segment":5,"confidence":12.735294117647008,"asi":{"hypothesis":"hidden_dim=784 — between 768 and 1024","rollback_reason":"macro F1 0.4947 — much worse. 768 is the peak.","next_action_hint":"hidden_dim=768 confirmed optimal. Try learning_rate sweep around 5e-4 (3e-4, 7e-4) with hidden=768."}}
{"run":60,"commit":"564bc98","metric":0.5128,"metrics":{"f1_central":0.3655,"f1_navarrese":0.2974,"f1_souletin":0.404,"f1_western":0.6789,"f1_nav-lab":0.8184,"accuracy":0.7034,"epochs":100,"lr":0.0005},"status":"discard","description":"hidden_dim=640 on balanced 10K. Macro F1 0.513 (worse). 768 is peak","timestamp":1781458865214,"segment":5,"confidence":13.221374045801527,"asi":{"hypothesis":"hidden_dim=640 — between 512 and 768","rollback_reason":"macro F1 0.5128 < 0.5193. Below the 768 peak.","next_action_hint":"hidden_dim=768 confirmed optimal. Try lr=7e-4 or lr=3e-4 with hidden=768."}}
{"run":61,"commit":"564bc98","metric":0.5194,"metrics":{"f1_central":0.3896,"f1_navarrese":0.3203,"f1_souletin":0.4072,"f1_western":0.663,"f1_nav-lab":0.8167,"accuracy":0.7022,"epochs":100,"lr":0.0007},"status":"discard","description":"hidden_dim=768 + lr=7e-4. Macro F1 0.5194 (within noise of 5e-4 best)","timestamp":1781459045424,"segment":5,"confidence":11.863013698630182,"asi":{"hypothesis":"lr=7e-4 with hidden_dim=768 — wider model may tolerate higher LR","rollback_reason":"macro F1 0.5194 ≈ 0.5193 best. Within noise. 5e-4 is canonical.","next_action_hint":"hidden_dim=768 + lr=5e-4 + dropout=0.3 = current best. Try batch_size tuning with hidden=768 next."}}
{"run":62,"commit":"564bc98","metric":0.5098,"metrics":{"f1_central":0.3196,"f1_navarrese":0.287,"f1_souletin":0.427,"f1_western":0.6853,"f1_nav-lab":0.8299,"accuracy":0.7164,"epochs":100,"lr":0.0003},"status":"discard","description":"hidden_dim=768 + lr=3e-4. Macro F1 0.510 (worse). 5e-4 optimal","timestamp":1781459048288,"segment":5,"confidence":13.221374045801527,"asi":{"hypothesis":"lr=3e-4 with hidden_dim=768 — slower convergence may help generalization","rollback_reason":"macro F1 0.5098 < 0.5193. 5e-4 is optimal across all hidden_dims.","next_action_hint":"hidden_dim=768 + lr=5e-4 + dropout=0.3 = current best. Try batch_size=128 (larger batch = more stable gradients)."}}
